{
  "$schema": "https://json-schema.org/draft/2020-12/schema",
  "type": "object",
  "required": [
    "id",
    "version",
    "system",
    "developer",
    "user_template",
    "variables",
    "guardrails",
    "few_shots",
    "eval"
  ],
  "properties": {
    "id": {
      "type": "string"
    },
    "version": {
      "type": "string"
    },
    "status": {
      "type": "string",
      "enum": [
        "draft",
        "active",
        "deprecated"
      ]
    },
    "category": {
      "type": "string"
    },
    "tags": {
      "type": "array",
      "items": {
        "type": "string"
      }
    },
    "model": {
      "type": "string"
    },
    "temperature": {
      "type": "number",
      "minimum": 0,
      "maximum": 2
    },
    "system": {
      "type": "string"
    },
    "developer": {
      "type": "string"
    },
    "user_template": {
      "type": "string"
    },
    "output_format": {
      "type": "object",
      "required": [
        "type"
      ],
      "properties": {
        "type": {
          "type": "string",
          "enum": [
            "text",
            "markdown",
            "json"
          ]
        },
        "schema": {
          "type": "object"
        },
        "instructions": {
          "type": "string"
        }
      }
    },
    "variables": {
      "type": "array",
      "items": {
        "type": "string"
      }
    },
    "context_sources": {
      "type": "array",
      "items": {
        "type": "object",
        "required": [
          "name",
          "type"
        ],
        "properties": {
          "name": {
            "type": "string"
          },
          "type": {
            "type": "string"
          },
          "required": {
            "type": "boolean"
          },
          "description": {
            "type": "string"
          }
        }
      }
    },
    "tools": {
      "type": "array",
      "items": {
        "type": "object",
        "required": [
          "name"
        ],
        "properties": {
          "name": {
            "type": "string"
          },
          "allowed": {
            "type": "boolean"
          },
          "policy": {
            "type": "string"
          }
        }
      }
    },
    "guardrails": {
      "type": "array",
      "items": {
        "type": "string"
      }
    },
    "constraints": {
      "type": "array",
      "items": {
        "type": "string"
      }
    },
    "style_rules": {
      "type": "array",
      "items": {
        "type": "string"
      }
    },
    "few_shots": {
      "type": "array",
      "items": {
        "type": "object",
        "required": [
          "input",
          "output"
        ],
        "properties": {
          "input": {
            "type": "string"
          },
          "output": {
            "type": "string"
          },
          "notes": {
            "type": "string"
          }
        }
      }
    },
    "changelog": {
      "type": "array",
      "items": {
        "type": "object",
        "required": [
          "version",
          "changes"
        ],
        "properties": {
          "version": {
            "type": "string"
          },
          "date": {
            "type": "string"
          },
          "changes": {
            "type": "array",
            "items": {
              "type": "string"
            }
          }
        }
      }
    },
    "eval": {
      "type": "object",
      "required": [
        "must_include",
        "must_not_include"
      ],
      "properties": {
        "must_include": {
          "type": "array",
          "items": {
            "type": "string"
          }
        },
        "must_not_include": {
          "type": "array",
          "items": {
            "type": "string"
          }
        },
        "checks": {
          "type": "array",
          "items": {
            "type": "object",
            "required": [
              "name",
              "type"
            ],
            "properties": {
              "name": {
                "type": "string"
              },
              "type": {
                "type": "string",
                "enum": [
                  "contains",
                  "not_contains",
                  "regex",
                  "json_schema",
                  "max_length"
                ]
              },
              "value": {},
              "description": {
                "type": "string"
              }
            }
          }
        }
      }
    }
  }
}

